{
  "$schema": "https://json-schema.org/draft/2020-12/schema",
  "$id": "goldenrod/call-sheet.schema.json",
  "title": "Call sheet",
  "description": "The trigger input. Goldenrod fires when the call sheet for the next shoot day is issued — a document the production office already makes, so nobody has to remember to run anything. `scenes` are the locked scene numbers scheduled for that day; they are the entry point for pipeline step 1 (PARSE DAY).",
  "type": "object",
  "required": ["production_id", "shoot_date", "revision_id", "scenes"],
  "additionalProperties": false,
  "properties": {
    "production_id": { "type": "string", "minLength": 1 },
    "call_sheet_id": { "type": "string" },
    "shoot_date": {
      "type": "string",
      "format": "date",
      "description": "The day these scenes shoot — tomorrow, relative to issue."
    },
    "issued_at": {
      "type": "string",
      "format": "date-time",
      "description": "When the production office issued it. This is the commitment boundary the check fires on."
    },
    "revision_id": {
      "type": "string",
      "minLength": 1,
      "description": "The script revision the day is scheduled against. The diff runs from this back to the prior revision."
    },
    "prior_revision_id": {
      "type": "string",
      "description": "The revision to diff against. Omit to use the most recent earlier revision on file."
    },
    "unit": { "type": "string", "default": "Main Unit" },
    "scenes": {
      "type": "array",
      "minItems": 1,
      "items": {
        "type": "object",
        "required": ["scene_number"],
        "additionalProperties": false,
        "properties": {
          "scene_number": {
            "type": "string",
            "description": "Locked scene number as printed on the pages. The stable coordinate — see the fact identity rule in db/clickhouse/schema.sql."
          },
          "int_ext": { "enum": ["INT", "EXT", "INT/EXT"] },
          "day_night": { "enum": ["DAY", "NIGHT", "DUSK", "DAWN", "CONTINUOUS"] },
          "location": { "type": "string" },
          "synopsis": { "type": "string", "maxLength": 300 },
          "page_eighths": { "type": "integer", "minimum": 0 },
          "cast_entity_ids": { "type": "array", "items": { "type": "string" } },
          "estimated_call": { "type": "string" }
        }
      }
    }
  }
}
